Title,Author,Rating,Genre
"Bloody Jack (Bloody Jack, #1)",L.A. Meyer,"4.11 avg rating — 26,032 ratings",Adventure
"Curse of the Blue Tattoo: Being an Account of the Misadventures of Jacky Faber, Midshipman and Fine Lady (Bloody Jack, #2)",L.A. Meyer,"4.27 avg rating — 12,563 ratings",Adventure
"In the Belly of the Bloodhound: Being an Account of a Particularly Peculiar Adventure in the Life of Jacky Faber (Bloody Jack, #4)",L.A. Meyer,"4.32 avg rating — 10,016 ratings",Adventure
"Under the Jolly Roger: Being an Account of the Further Nautical Adventures of Jacky Faber (Bloody Jack, #3)",L.A. Meyer,"4.33 avg rating — 11,043 ratings",Adventure
"The Golden Compass (His Dark Materials, #1)",Philip Pullman,"4.01 avg rating — 1,465,757 ratings",Adventure
"My Bonny Light Horseman: Being an Account of the Further Adventures of Jacky Faber, in Love and War (Bloody Jack, #6)",L.A. Meyer,"4.25 avg rating — 7,498 ratings",Adventure
"Mississippi Jack: Being an Account of the Further Waterborne Adventures of Jacky Faber, Midshipman, Fine Lady, and Lily of the West (Bloody Jack, #5)",L.A. Meyer,"4.20 avg rating — 8,592 ratings",Adventure
"Rapture of the Deep: Being an Account of the Further Adventures of Jacky Faber, Soldier, Sailor, Mermaid, Spy (Bloody Jack, #7)",L.A. Meyer,"4.27 avg rating — 6,526 ratings",Adventure
"The Wake of the Lorelei Lee: Being an Account of the Adventures of Jacky Faber, on her Way to Botany Bay (Bloody Jack, #8)",L.A. Meyer,"4.25 avg rating — 5,554 ratings",Adventure
"The Cavalier (Heroes of the Empire, #1)",Israh Azizi,4.47 avg rating — 72 ratings,Adventure
The Hobbit,J.R.R. Tolkien,"4.28 avg rating — 3,661,189 ratings",Adventure
"The City of Ember (Book of Ember, #1)",Jeanne DuPrau,"3.89 avg rating — 271,942 ratings",Adventure
"Artemis Fowl (Artemis Fowl, #1)",Eoin Colfer,"3.86 avg rating — 536,546 ratings",Adventure
The Odyssey,Homer,"3.80 avg rating — 1,017,296 ratings",Adventure
"A Game of Thrones (A Song of Ice and Fire, #1)",George R.R. Martin,"4.44 avg rating — 2,355,201 ratings",Adventure
"Howl’s Moving Castle (Howl’s Moving Castle, #1)",Diana Wynne Jones,"4.29 avg rating — 306,156 ratings",Adventure
"The Dark Is Rising (The Dark is Rising, #2)",Susan Cooper,"4.06 avg rating — 54,460 ratings",Adventure
The Lord of the Rings,J.R.R. Tolkien,"4.52 avg rating — 644,622 ratings",Adventure
The Poisonwood Bible,Barbara Kingsolver,"4.09 avg rating — 716,784 ratings",Adventure
"The Name of the Wind (The Kingkiller Chronicle, #1)",Patrick Rothfuss,"4.52 avg rating — 891,705 ratings",Adventure
"The Warrior Heir (The Heir Chronicles, #1)",Cinda Williams Chima,"3.94 avg rating — 51,418 ratings",Adventure
"The Fellowship of the Ring (The Lord of the Rings, #1)",J.R.R. Tolkien,"4.38 avg rating — 2,686,419 ratings",Adventure
"Poison Study (Study, #1)",Maria V. Snyder,"4.10 avg rating — 160,703 ratings",Adventure
"The Mark of the Golden Dragon: Being an Account of the Further Adventures of Jacky Faber, Jewel of the East, Vexation of the West, and Pearl of the South China Sea (Bloody Jack, #9)",L.A. Meyer,"4.11 avg rating — 4,493 ratings",Adventure
"The Hitchhiker's Guide to the Galaxy (Hitchhiker's Guide to the Galaxy, #1)",Douglas Adams,"4.23 avg rating — 1,739,126 ratings",Adventure
"The Return of the King (The Lord of the Rings, #3)",J.R.R. Tolkien,"4.56 avg rating — 829,912 ratings",Adventure
The Unparalleled Adventure of One Hans Pfaall,Edgar Allan Poe,"3.08 avg rating — 1,135 ratings",Adventure
Treasure Island,Robert Louis Stevenson,"3.84 avg rating — 464,545 ratings",Adventure
Saving Paradise (Pono Hawkins #1),Mike Bond,"3.67 avg rating — 1,201 ratings",Adventure
The Princess Bride,William Goldman,"4.26 avg rating — 870,097 ratings",Adventure
Don't Let's Go to the Dogs Tonight: An African Childhood,Alexandra Fuller,"3.96 avg rating — 54,140 ratings",Adventure
Nim's Island (Nim #1),Wendy Orr,"3.89 avg rating — 4,799 ratings",Adventure
Life of Pi,Yann Martel,"3.93 avg rating — 1,551,752 ratings",Adventure
The Iliad,Homer,"3.90 avg rating — 424,522 ratings",Adventure
"The Subtle Knife (His Dark Materials, #2)",Philip Pullman,"4.14 avg rating — 420,108 ratings",Adventure
Ivanhoe,Walter Scott,"3.76 avg rating — 92,494 ratings",Adventure
"Viva Jacquelina! Being an Account of the Further Adventures of Jacky Faber, Over the Hills and Far Away (Bloody Jack, #10)",L.A. Meyer,"4.12 avg rating — 3,690 ratings",Adventure
"Lonesome Dove (Lonesome Dove, #1)",Larry McMurtry,"4.52 avg rating — 176,631 ratings",Adventure
"Harry Potter and the Deathly Hallows (Harry Potter, #7)",J.K. Rowling,"4.62 avg rating — 3,467,371 ratings",Adventure
"The Wise Man's Fear (The Kingkiller Chronicle, #2)",Patrick Rothfuss,"4.55 avg rating — 519,470 ratings",Adventure
"The Chronicles of Narnia (Chronicles of Narnia, #1-7)",C.S. Lewis,"4.27 avg rating — 616,848 ratings",Adventure
"The Dark Hills Divide (The Land of Elyon, #1)",Patrick Carman,"3.74 avg rating — 21,565 ratings",Adventure
"The Tenth City (The Land of Elyon, #3)",Patrick Carman,"3.97 avg rating — 9,257 ratings",Adventure
"Beyond the Valley of Thorns (The Land of Elyon, #2)",Patrick Carman,"3.93 avg rating — 13,309 ratings",Adventure
"Eragon (The Inheritance Cycle, #1)",Christopher Paolini,"3.94 avg rating — 1,675,622 ratings",Adventure
"+Anima 1 (+Anima, #1)",Natsumi Mukai,"4.17 avg rating — 7,581 ratings",Adventure
"The Horse and His Boy (Chronicles of Narnia, #5)",C.S. Lewis,"3.91 avg rating — 329,698 ratings",Adventure
"Magyk (Septimus Heap, #1)",Angie Sage,"3.84 avg rating — 118,176 ratings",Adventure
Journey to the Center of the Earth,Jules Verne,"3.86 avg rating — 186,445 ratings",Adventure
The Narrative of Arthur Gordon Pym of Nantucket,Edgar Allan Poe,"3.51 avg rating — 11,137 ratings",Adventure
"Pieces of Eight: A Story of Sex & Love, Trust & Betrayal",Michael Richard Reed McLaughlin,3.50 avg rating — 26 ratings,Adventure
"Airborn (Matt Cruse, #1)",Kenneth Oppel,"4.18 avg rating — 24,961 ratings",Adventure
"Redwall (Redwall, #1)",Brian Jacques,"4.13 avg rating — 114,651 ratings",Adventure
"Song of the Current (Song of the Current, #1)",Sarah Tolcser,"3.86 avg rating — 3,982 ratings",Adventure
"The Cavalier (Heroes of the Empire, #1)",Israh Azizi,4.47 avg rating — 72 ratings,Adventure
"Starclimber (Matt Cruse, #3)",Kenneth Oppel,"4.22 avg rating — 8,801 ratings",Adventure
"Martin the Warrior (Redwall, #6)",Brian Jacques,"4.16 avg rating — 42,051 ratings",Adventure
"Sun and Moon, Ice and Snow",Jessica Day George,"3.98 avg rating — 21,844 ratings",Adventure
"Whisper of the Tide (Song of the Current, #2)",Sarah Tolcser,"4.06 avg rating — 1,088 ratings",Adventure
Ocean's Echo,Everina Maxwell,"4.16 avg rating — 4,633 ratings",Adventure
"Skybreaker (Matt Cruse, #2)",Kenneth Oppel,"4.26 avg rating — 12,322 ratings",Adventure
The Jungle Book,Rudyard Kipling,"3.91 avg rating — 118,264 ratings",Adventure
"Mattimeo (Redwall, #3)",Brian Jacques,"4.07 avg rating — 34,287 ratings",Adventure
"The Long Way to a Small, Angry Planet (Wayfarers, #1)",Becky  Chambers,"4.18 avg rating — 125,692 ratings",Adventure
"Stormbreaker (Alex Rider, #1)",Anthony Horowitz,"3.98 avg rating — 98,175 ratings",Adventure
The Flame Trees of Thika: Memories of an African Childhood,Elspeth Huxley,"4.11 avg rating — 5,539 ratings",Adventure
"The Three Musketeers (The D'Artagnan Romances, #1)",Alexandre Dumas,"4.09 avg rating — 310,985 ratings",Adventure
"The Oaken Throne (The Deptford Histories, #2)",Robin Jarvis,4.26 avg rating — 543 ratings,Adventure
"The Hundred-Year-Old Man Who Climbed Out of the Window and Disappeared (The Hundred-Year-Old Man, #1)",Jonas Jonasson,"3.82 avg rating — 261,375 ratings",Adventure
The Wind Through the Keyhole,Stephen King,"4.15 avg rating — 78,113 ratings",Adventure
"Thomas (The Deptford Histories, #3)",Robin Jarvis,4.11 avg rating — 380 ratings,Adventure
"Less Is Lost (Arthur Less, #2)",Andrew Sean Greer,"3.76 avg rating — 11,019 ratings",Adventure
Don Quixote,Miguel de Cervantes Saavedra,"3.89 avg rating — 254,211 ratings",Adventure
"Thorn Ogres Of Hagwood (The Hagwood Trilogy, #1)",Robin Jarvis,3.77 avg rating — 376 ratings,Adventure
"Magician (The Riftwar Saga, #1-2)",Raymond E. Feist,"4.31 avg rating — 65,279 ratings",Adventure
"Dark Waters Of Hagwood (The Hagwood Trilogy, #2)",Robin Jarvis,3.92 avg rating — 63 ratings,Adventure
"Scorpia (Alex Rider, #5)",Anthony Horowitz,"4.18 avg rating — 57,259 ratings",Adventure
War in Hagwood (The Hagwood Trilogy Book 3),Robin Jarvis,4.06 avg rating — 36 ratings,Adventure
"Ten Years Later (The D'Artagnan Romances, #3.2)",Alexandre Dumas,"3.96 avg rating — 2,818 ratings",Adventure
"Beet the Vandel Buster, Vol. 1",Riku Sanjo,4.06 avg rating — 293 ratings,Adventure
"Twenty Years After (The d'Artagnan Romances, #2)",Alexandre Dumas,"4.07 avg rating — 23,001 ratings",Adventure
Kazan (Kazan #1),Gaku Miyao,3.83 avg rating — 52 ratings,Adventure
Legenda Naga Vol. 1,Yoshito Yamahara,4.19 avg rating — 407 ratings,Adventure
"The Two Towers (The Lord of the Rings, #2)",J.R.R. Tolkien,"4.47 avg rating — 890,152 ratings",Adventure
Drifters Volume 1,Kohta Hirano,3.83 avg rating — 534 ratings,Adventure
"Little (Grrl) Lost (Newford, #16)",Charles de Lint,"3.74 avg rating — 1,973 ratings",Adventure
Timeline,Michael Crichton,"3.86 avg rating — 201,370 ratings",Adventure
"Hunter x Hunter, Vol. 01 (Hunter x Hunter, #1)",Yoshihiro Togashi,"4.53 avg rating — 49,712 ratings",Adventure
The Silmarillion,J.R.R. Tolkien,"3.99 avg rating — 269,462 ratings",Adventure
"The Voyage of the Dawn Treader (Chronicles of Narnia, #3)",C.S. Lewis,"4.09 avg rating — 448,829 ratings",Adventure
Pirates!,Celia Rees,"3.83 avg rating — 16,092 ratings",Adventure
"Dealing with Dragons (Enchanted Forest Chronicles, #1)",Patricia C. Wrede,"4.15 avg rating — 88,907 ratings",Adventure
"The Lion, the Witch and the Wardrobe (Chronicles of Narnia, #1)",C.S. Lewis,"4.23 avg rating — 2,619,809 ratings",Adventure
"Alanna: The First Adventure (Song of the Lioness, #1)",Tamora Pierce,"4.26 avg rating — 126,580 ratings",Adventure
Five Weeks in a Balloon,Jules Verne,"3.76 avg rating — 23,079 ratings",Adventure
"The Girl in the Steel Corset (Steampunk Chronicles, #1)",Kady Cross,"3.80 avg rating — 21,414 ratings",Adventure
"Harry Potter and the Order of the Phoenix (Harry Potter, #5)",J.K. Rowling,"4.50 avg rating — 3,146,855 ratings",Adventure
The Seer and the Sword,Victoria Hanley,"4.12 avg rating — 10,621 ratings",Adventure
"Throne of Glass (Throne of Glass, #1)",Sarah J. Maas,"4.19 avg rating — 1,025,843 ratings",Adventure
"Harry Potter and the Goblet of Fire (Harry Potter, #4)",J.K. Rowling,"4.56 avg rating — 3,396,255 ratings",Adventure
